"Classe";"Texto"
"Contras";"cheiro ruim depois que desliga o ar, seta imprecisa, buzina imprecisa, suspensão barulhenta e pouco durável, bancos desconfortáveis cujo assento cede precocemente, posição das teclas dos vidros, visibilidade traseira, câmbio de manuseio cansativo e como um todo é pouco manobrável, requer disposição do condutor, por isso o tenho como contra indicado para iniciantes na direção."
"Contras";"peças um pouco mais caras, revenda, o povo brasileiro ainda é um povo ultrapassado em relação a esse tipo de coisa, motor 1.0 com 16v muito fraco,ainda mais em cidade, tem q esperar esquentar bem o carro, pq o carro fica travando nas primeiras marchas e ameaça morrer."
"Contras";"Ruídos internos excessivos, a suspensão faz um ruído quando molhada e exigida, passando em um quebra molas, por exemplo. É um barulho tipo uma dobradiça mal lubrificada."
"Contras";"Muito barulhento, pelo que me falaram o consumo era baixo, não achei, por malas minusculo, o carro bate tudo, os vidros o porta mala, tenho maisgos que tem o 307 e apresenta o mesmo barulho"
"Contras";"nada a declarar."
"Contras";"Os conhecidos grilos do 206 nada demais ja tive gol e ja andei nos demais carros comparados a ele e todos tem barulho embora pelos comentarios aqui muita gente adora apedrejar o 206..."
"Contras";"Barulhento, muitos defeitos"
"Contras";"suspensao dianteira muito dura"
"Contras";"Rigidez que provoca alguns ruídos na carroceria, em especial na coluna esquerda da porta dianteira. Pequeno espaço do porta-malas."
"Contras";"Muito barulhento. O motor ronca muito e tem muitos ruídos internos. A cada dia um novo barulho aparece.Manutenção cara; Seguro caro;Espaço no banco de trás é péssimo. Quase não dá pra entrar se os bancos da frente não forem colocados mais pra frente. O banco do motorista não tem ajuste que te deixe confortável. A visibilidade fica prejudicada. O carro fazia 14,5 km (gas) na cidade e passou a fazer 12 km. Ainda não descobri o que é.Suspensão duríssima e pra terminar, o motor sempre dá umas falhadas. Não sei mais o que fazer, já troquei filtro de óleo, ar, combustível. Jogo de velas e limpeza de bicos..."
"Contras";"na cidade o 206 é uma porcaria, vamos ser sincero...oooww carrinho barulhento do kct...se vc colocar qualquer autofalante q seja o menor peso, ele faz barulho atraz gente..chega ser incrivel como esse carro faz barulho...sem contar q aquele modo de usar o banco dianteiro já dei bastante caxeta nos outros...pq vcs podem ver q a velocidade q o banco vem pra frente é ignorante..o porta mala foi realmente feito para o estilo de pessoas q vai somente ao clube de final de semana...pq se vc for viajar com sua namorada e amigos...vc ta na merda, o porta mala é bem pequeno..se vc estiver uma caixa de som atraz,pronto...matou o porta malas!!rs"
"Contras";"duas portas"
"Contras";"Carro extremamente barulhento, mesmo com menos de 2.500 km (isso que é o modelo de luxo).O potente motor 1.4 que já é fraco por natureza, quando ligamos o ar condicionado o carro só falta morrer, chega a ser ridiculo o desempenho.Assistencia tecnica e mão de obra caríssimas, e de 5º categoria.Não comprem peugeot, na hora de vender todos são atenciosos, mas nunca... reze para nunca precisar de assistencia técnica (meio dificil)."
"Contras";"A suspensão é realmente um problema, ainda mais nessas ruas podres do Brasil, nada que uma manutenção preventiva e barata de troca de buchas não resolva!"
"Contras";"espaço interno para passageiros traseiro muito apertado (versão esportiva 2 portas igual o meu)sistema de suspensão frágil para nossas ruas esburacadasretrovisor pequenorelação de marchas muito longas"
"Contras";"O Cambio nao possui engates suaves, mas acostuma-se rapidamente. Suspensao privilegia a esportividade, logo torna-se um carro ``duro`` em ruas esburacadas."
"Contras";"SEGURO CARO, SEM ASSINTENCIA TECNICA E CARA, RUIDOS, BEBAO"
"Contras";"- Porta Malas Pequeno- Barulho Interno (Após uma visita em uma especializada Peugeot, conseguiram tirar)- Suspensao Dura para SP"
"Contras";"O atendimento no momento da venda é pior impossível. Fui mal atendida e mesmo tendo pago o carro à vista, ouve a maior enrolação no momento da entrega. Fiquei horas sentada esperando."
"Contras";"A concessionária fez pouco caso na entrega do veículo."
"Contras";"Acho que apesar de ele ser um carro esportivo, pelo menos tem um designer nesse estilo, poderia ter um porta malas maior, mas como minha familia é pequena tudo bem, porém algo que detesto é a roda ficar embaixo, tentam furtar por isso é ruim, tem que se colocar correntes na trava que prende o pneu,colocar cadeados ou ainda o pneu dentro do porta mala que já é pequeno, ai fica meio ruim.O ar, o computador de bordo(tão chique né para 1.0) é 10..adoro até a pequena siorene que toca quando esqueço de desligar as luzes...esse carro é chique!!! adoro ele, por isso quando vou trocá-lo por um peugeot mais novo, mas não o largo!!"
"Contras";"peças caríssimas"
"Contras";"O banco do motorista é muito mal projetado. Não permite um encosto parelho das costas e causa dores em viagens. O motor engasga em acelerações rápidas e morre as vezes ao engatar a primeira marcha."
"Contras";"Ruídos internos altos, porta malas muito pequeno, acionador dos vidros elétricos no console central tando dianteiros quanto traseiros."
"Contras";"Suspensão muuuito fraca: Nas 3 revisões que fiz, deu problema de vazamento de óleo no amortecedor e tive que trocar. foi caroBuzina dura.Marcha Ré as vezes é difícil de entrar sem barulho.Problema no medidor de combustível."
"Contras";"- O seguro é um pouco caro mesmo (pago em torno de R$ 1500,00);- Ruídos internos (e não são poucos) no porta-malas, portas, etc.- Suspensão dura;- A manutenção não posso opinar pq ainda não precisei fazer nada além do normal;- No caso do meu carro (modelo 3 portas) o acesso ao banco traseiro é difícil, e o espaço do mesmo é insatisfatório."
"Contras";"Como todo carro que anda nas estradas e ruas do brasil com o 206 não podia ser diferente o carro sofre bastante com os buracos e crateras de nossas ruas. Os grilos são comuns e o acabamento das portas poderia ser melhor com certeza. Outro ponto negativo do carro é o consumo que pelo menos até onde pude perceber não chega nem perto do divulgado pela montadora, o carro abastecido no alcool não faz mais do que 6,5 km/l andando na cidade com o ar ligado e na estrada não passa de 7,5 apesar de andar sempre com o pé pesado. No meu caso o carro faz 5,7 na cidade e 6,5 na estrada, bebe mesmo. O espaço interno é outro ponto a ser pensado, caso você vá ultilizar mais do que 2 lugares do carro com frequência é aconselhavel estudar outras marcas. Quatro adultos já viajam com algum desconforto mas se você pretende usar o carro com 2 adultos e no maximo 1 criança o carro é muito confortavel. O porta malas não é grande mas para o que o carro se propoe cumpre bem o seu papel."
"Contras";"O 206 tem a frente muito baixa que sofre nas nossas ruas brasileiras pessimamente projetadas. Não é comum acharmos usados sem riscos na parte inferior dos pára-choques. Modelos semi-novos com direção hidráulica costumam apresentar barulhos em manobras de estacionamento e um ligeiro vazamento do fluído de direção, fique atento! Os preços das peças é alto e ainda não são encontradas no mercado de peças paralelas. Esse é um dos motivos para o preço do seguro absurdo. O Excesso de partes plásticas no interior do carro faz com que (grilos) apareçam por toda parte. A solução que eu encontrei? Um bom sistema de som ajuda! A suspensão é um pouco dura e nos faz sentir toda a irregularidade das nossas ruas e estradas esburacadas. Não se iluda com o fato do carro ter sido campeão mundial de Rali várias vezes, aquele era um outro 206 totalmente modificado. O nosso modelo é baixo demais e pode ser facilmente danificado em vias sem pavimentação."
"Contras";"O Cambio trepida um pouco em segunda marcha, mas nada que assuste. As luzes de freio demoram um pouco para se acenderem ao pisar no freio levemente."
"Contras";"Barulhos internos com o passar dos anos. Problemas eletricos com painel de instrumentos e chave de seta. Buzina dura. Suspensão delicada, quebra mto. Cambio enrosca a ré. Ar Condicionado barulhento."
"Contras";"O negativo é a desvalorização. Eu fiz o certo, comprei o meu por um valor bem abaixo da tabela FIPE."
"Contras";"suspensão é muito fraca, em uma rua que tenha ondulações ele faz mais barulho que a sapucai no dia de carnaval, as peças tambem são caras e a parte eletrica da muito problema."
"Contras";"Tive que fazer revisão tão logo comprado. já tinha 52.000km rodados"
"Contras";"Sua suspensão parece ser feita de papelão. Em 03 anos de uso, devo ter trocado bandejas e bieletas umas 3 ou 4 vezes. A parte elétrica é horrível: Só existem 2 tipos de 206: Os que já deram trabalho com a parte elétrica Marcador de combustível, sensor de portas-abertas, sensor de rotação, comandos de luzes, buzinas e etc e aqueles que ainda vão ter."
"Contras";"Suspensão traseira, o eixo é a doença da série de torção. A suspensão dianteira, a bandeja em formato bumerangue parte fácil o embuchamento e bate ferro-ferro."
"Contras";"quese nada"
"Contras";"suspensão e potencia na versão 1.0 16v"
"Contras";"PEÇAS CARAS .......E PARTE ELETRICA MUITO COMPLICADA DE MEXER..."
"Contras";"Barulho do escapamento parece que ta solto.. Manutenção preventiva muito cara... R$600,00 pra eles verem uma meia duzia de itens, trocar oleo, velas, oleo de freio...."
"Contras";"não se dá muito bem em buracos"
"Contras";"pouco conforto para viajar, carro com pouca estabilidade e porta mala pequeno, carro pessimo para familia"
"Contras";"O MOTOR NÃO VALE NADA!!!"
"Contras";"Ruidos excessivos no porta malas e o estepe, que fica embaixo do veiculo e acaba facilitando o furto."
"Contras";"Ruido do porta malas, suspensão já quebrou duas vezes, 4000 Reais cada vez. Barulho no limpador, nao adianta trocar por novo. Parabrisa embaça fácil. Custo altíssimo de manutenção. Tem erro de projeto na suspensão, com rolamentos sobre o eixo. Nunca se troca só o rolamento, precisa trocar o eixo todo."
"Contras";"o eletricista da concessionária condenou toda a parte elétrica do meu carro onde ficou avaliado peças e mão de obra mais de 10 mil reais. Suspensão totalmente despreparada para as ruas e vias do brasil. Preciso falar mais????"
"Contras";"vário ruídos internos, porta mala não cabe nada, step embaixo do carro é uma porcaria, quando a versão do veículo não tem direção hidráulica, é muito ruim. Quando se tem algum problema na parte elétrica ou eletrônica é difícil localizar o problema ocasionando assim trocas de peças que nem seria necessária, gastando assim um NOTA!!!! È certo de a buzina falhar com pouco tempo de uso. Suspensão de baixa qualidade."
"Contras";"suspensao um pouco fragil, desvalorização na revenda"
"Contras";"ele desligava sozinho, normalmente quando o ar condicionado estava ligado, tinha levado em algumas mecanicas ninguem sabia o que era, depois que vendi fui descobrir que as concessionarias trocam um chicote sem cobrar nada."
"Contras";"aki na minha cidade tem muitas ruas com remendo entao é ruim pa andar em ruas assim.devia usar oleo mineral pois o sintetico é muito caro"
"Contras";"Quase os mesmos de um Fiesta, um Corsa, um Palio..."
"Contras";"SUSPENSÃO MUITO FRACA E PEÇAS DE REPOSIÇÃO MUITO CARAS PARA UM VEICULO TIDO COMO POPULAR."
"Contras";"suspensao meia dura,"
"Contras";"Barulhos na tampa do porta malas."
"Contras";"Custo de manutenção. Problemas crônicos conhecidos: chave de seta suspensão dura baixa óleo se bater na traseira o carro deverá ser remarcado pois a posição do chassi é afetada."
"Contras";"revenda, suspensão de plástico, direção hidraulica pesada, espaço do porta-malas, ruidos interno e externo, etc ."
"Contras";"A suspensão é muito ruim."
"Contras";"preço das peças e cambio"
"Contras";"Amortecedores frágeis ruído interno muito alto desvalorização e seguro muito alto."
"Contras";"A suspensão é horrível troquei TODA a suspensão do carro 2 vezes, o seguro é muito caro para o meu perfil 18-25 anos, e vive dando probleminhas em componentes como ar-condicionado, módulo de alarme e as peças são muuuuuito caras!"
"Contras";"Chave de seta já tem a fam a de dar problema, podendo gerar sustos em comunicação com os faróis sintomas semelhantes a maus contatos, dificuldade para encontrar peças. Não colocar na mão de qualquer um para manutenir."
"Contras";"Suspensão fraca para nossa ruas ruins e desvalorização acima dos demais."
"Contras";"Peças muito caras"
"Contras";"suspensão é fraca, ruidos internos"
"Contras";"Carro muito frágil. Tive que fazer a suspensão toda dele com menos de 40.000 e a direção também com cerca de 46.000. A Peugeot é uma piada! Fiz uma revisão que gastei R$ 930,00 e o carro saiu de lá pior do que entrou, gastando mais 5,8 km/l e com luzes queimadas. Quando opera em Álcool é difícil de pegar de manhã."
"Contras";"Suspensão fraca. Grande desvalorização. Difícil Revenda. Se você comprou abaixo da tabela não terá problemas na hora da venda. Peças só na concessionária. Custo Elevado."
"Contras";"porta malas pequeno, localizaçao do estepe,como o meu é 2 portas nao é bom para quem tem filho pequeno"
"Contras";"Revenda ruim, porta malas pequeno, mas essa não é a proposta do carro então não seria um ponto tão negativo. Agora uma coisa horrivel é a posição do pneu de estepe, cara debaixo do carro, vc se suja todo p trocar o pneu e pior ainda é p colocar de volta. nisso a empresa pecou mesmo."
"Contras";"Porta malas"
"Contras";"suspensão dianteira faz muito barulho....o porta malas é pequeno, o carro é bom pra quem viaja com pouca bagagem"
"Contras";"Só meio baixo na frente."
"Contras";"desvalorização, atendimento péssimo da autorizada peugeot Monet Campo Grande-MS,peças e manutenção muito caras."
"Contras";"SEGURO CARISSIMO, GRANDE DESVALORIZAÇAÕ NA HORA DE VENDER, COM O TEMPO VAI COMEÇANDO A APRESENTAR BARULHO INTERNO E PEÇAS A PESO DE OURO"
"Contras";"Muuuuiiito ruim de revenda, peças e manutenção caríssimas, a suspensão é uma manteiga e visibilidade baixa."
"Contras";"lataria, descasa mais facil que cebola, medida das rodas é dificil de encontrar 4/108, sendo q o padrão é 4 /100"
"Contras";"A suspenção do 206 não foi feita para andar em solos Brasileiros, o carro se torna duro em pisos irregulares, o ponto mais fraco deste carro eu digo que é a suspenção!"
"Contras";"Em minha opiniao, os pon tos negativos dele são: a suspensão mt frágil, o retrovisor mt pequeno o q dificulta a visibilidade e o barulhinho interno que aparece e some, sem conseguirmos identificar o q é afinal. ah, o local do estepe, dificulta a troca do pneu."
"Contras";"preço das peças."
"Contras";"Preços das peças sao muito altas Disponibilidade de peças nas autorizadas é muito pequeno, nunca tem a peça q vc precisaEspaço para passageiros do banco de tras estremamente pequeno.Porta mala pequenomas o pior mesmo é o estepe embaixo do carro, pra tirar eh facil, agora pra colocar, eh muito complicado e ainda temos q usar uma corrente pra prender o pneu se nao o mesmo eh roubado.é Um otimo carro pra quem tem dinheiro e pode pagar a sua manutenção, pq qnd começa a dar dor de cabeça, não sai da oficinaJunta da tampa de valvulas eh um problema cronico, vive vazando óleo, troca a cada de meses"
"Contras";"O carro é frágil e sensível, principalmente quando se trata de água, pois a tubulação do filtro de ar estende-se por trás do pára-choque dianteiro e vai até o pára-lamas do lado do motorista. Se você for enfrentar uma poça dágua, a água pode ser aspirada para dentro do motor, provocando calço hidráulico aconteceu comigo.Apesar de ser um carro de preço acessível, sua manutenção é bastante dispendiosa. O preço das peças na autorizada é um absurdo, e pasmem, nas auto-peças comuns, muitas vezes as peças são ainda mais caras. Portanto, antes de fazer algum serviço, recomendo uma boa pesquisa de preços, só assim é possível minimizar o prejuízo.O carro apresenta muitos ruídos internos painel e tampa do porta-malas e externos nas rodas dianteiras e o motor parece que estar soprando o tempo todo, como se tivesse um vazamento de ar."
"Contras";"Acho que, com certeza dos pontos negativos desse carro o que é mais considerado é o alto preço de manutenção e as peças, são caras demais.E é muito dificil axar onde de fato esta o defeito."
"Contras";"suspensao barulhenta, seta só isso"
"Contras";"o farol queima muita lampada, o porta malas pequeno"
"Contras";"Quando se faz um orçamento de peças para este carro, parece que você tem um Mercedes estacionado em sua garagem, principalmente na rede autorizada, os valores não condizem com o veículo. A desvalorização infelizmente é absurda.Marcha: Parece uma caixa de marcha seca, as trocas apesar de serem precisas são parecidas com as de um fiat 147 ou um Uno 80epoucos...Imagino eu que por ser um carro esportivo, a suspensão tende a ser um pouco mais rígida que o normal, mas isto causa certo desconforto.Mesmo sendo um modelo ``Rallye´´,estrada de terra nem pensar!! O carro muito baixo e pega em tudo que é lugar mesmo dentro da cidade. Não se engane pelo nome."
"Contras";"Peças da mecânica um pouco mais caras mais issu compensa pelo conforto apresentado. O q me encomoda muito é o barulho pra tudo q é lugar, odeio carro barulhento e o motor tbm é bastante ruidoso. Só to pensando em trocar ele por causa da escola de samba que tem na cabine desse carro. Tem um grilo na coluna lateral q num acho nem por reza e é insuportavel."
"Contras";"Muitos ruidos que nem a autorizada descobriu. O cambio faz barulho estranho e as vezes o engate nao é preciso."
"Contras";"O custo das peças e manutenção um pouco mais alta que os da mesma categoria, mas aceitável pelo conforto e outros pontos."
"Contras";"o ponto negativo e o volante que acaba rápido de mais com pouco tempo,o meu carro tem 48.000 km/h rodados e já tive que romprar outro volante"
"Contras";"o ruido do motor é o pior parece que ele esta dentro do carro. Peças muuuito caras. alto consumo."
"Contras";"Alto custo de manutenção."
"Contras";"As colunas do teto são muito largas causando Grandes pontos cegos no veiculo, necessitando maior cautela ao dirigir, tanto para entrar em um via qto em uma curva em bairros, pois pode esconder um pedestre ou um moto boy abusado. qto aos ruidos todos os carros tem alguns eu resolvo os do meu lavando e lubrificando com cilicone em spray plasticos e borrachas fica perfeito, e oleo spray em juntas e peças de atuação metalicas, acaba o problema. se o C4 palace pode vir com painel solto pq o 206 não pode fazer inhec inhec nas tampas de portas??? rs, qto a borrachas de portas, nada como instalar elas com silicone não entra nem poeira! rs e facil troca pois fixa!!! e não cola para sempre. para se arrumar uma peça tem que se desmontar outra encarescendo na mão de obra e aumentando no tempo de reparo e reposição de peças mecânicas de desgaste do cotidiano, parece carro de mecânica alemã que não foi feito pra fazer manutenção, tendo dificuldades até pra fazer a simples troca de oleo."
"Contras";"Durabilidade geral do carro: vendi o carro com 50.000km porque não agüentava mais as surpresas com quebras prematuras.O valor de manutenção e seguro são muuuuuuuuuito caros."
"Contras";"porta malas podia ser maior, alguns ruidos nas portas mais facil de resolver e alavanca que as vezes balança um pouco"
"Contras";"Suspensão dura, desvalorização na venda, peças caras, seguro caríssimo."
"Contras";"A suspensão da um pouco de dor de cabeça mas isso é mais do que normal, pq aqui no rj só a av das americas tem um bom asfalto o resto é só buraco, ne jipe aguenta. A partida a frio tb deixa a desejar."
"Contras";"Ruído do motor."
"Contras";"Suspensâo dura"
"Contras";"Pouca Retomada em ultrapassagens, suspenção muito dura, pouco espaço no pota malas e passageiros"
"Contras";"O meu não faz barulho só é uma escola de samba,paguei em homocinetica usada 600 reais, bobina 300 reais, dificuldade em encontrar peças,para vocês terem uma ideia aquele existem peças simples que custam 57 reais em um palio nesse aqui é 400 reais."
"Contras";"Infelizmente ainda existe um desvalorização no mercado, apesar de ter diminuido bastante ao londo dos anos."
"Contras";"CARRO MEGA SUPER ULTRA FRAGIL, CUIDADO! NAO ASSOPRE PERTO DO MEU PEUGEOT 206!!!!"
"Contras";"Ruídos internos tampão do porta-malas. Em dias de frio o carro demora um pouco até funcionar."
"Contras";"ruidos internos, preço das peças na concessionária, atendimento da concessionária, chave de seta com defeito na maioria dos carros fabricados, suspensão dura, borracha da porta tem emenda, o que pode provocar entrada de agua em ocasioes específicas."
"Contras";"CHAVE DE SETAS, COM UM ANO DE USO TIVE QUE TROCÁ-LA - DEFEITO CRÔNICO QUE DEVERIA SER OBJETO DE RECAL, PORÉM, O POVO BRASILEIRO É SOSSEGADO.A PEUGEOTO TIRA CARRO DE LINHA C/MUITA FACILIDADE E FAZ MAQUIAGEM, CASO DO 207 Q É UM 206 MAQUIADO. ACORDA PEUGEOT."
"Contras";"por meu carro ser mais velho, 2002, não posso exigir mto dele, e realmente é um carro pra asfalto, terra só as vezes, e por ter mtos opcionais apresenta mais defeitos, mas nada que não possa ser resolvido. se quer economia compre um nacional básico, pois até os nacionais com alguns acessórios dão problema, mta depreciação na venda."
"Contras";"BAIXA QUALIDADE NAS PEÇAS, INTERIOR E SUSPENSÃO BARULHENTA, EXTREMAMENTE FRÁGIL E COM ALTO CUSTO DE MANUTENÇÃO"
"Contras";"SE VOCE GANHA POUCO, OU NAO TEM CONDIÇÕES DE MANTER UM CARRO IMPORTADO NAO COMPRE, A MANUTENÇÃO DESDE A PREVENTIVA ATÉ A CORRETIVA NÃO É BARATO."
"Contras";"manutenção é salgada"
"Contras";"Peças com preço alto e de má qualidade, além de serem difíceis de encontrar, desvalorização acentuada na revenda, poucas concessionárias"
"Contras";"Nem a própria rede Peugeot se esforça para manter um nível de valorização de seus produtos. A desvalorização é acima da média por questões de mercado, reflexo direto do seu custo de manutenção mais elevado e nível de fragilidade de componentes importantes do veículo, tais como a suspensão traseira e a multiplexagem eletrônica da Peugeot, origem de defeitos quando não trabalha com acessórios elétricos apropriados. Resumindo: o carro é refinado, exige acessório original. É como uma placa mãe de computador de griffe, exige componente específico só para ele."
"Contras";"O carro é muito pequeno por dentro, ideal para 2 pessoas pois quem entrar atrás ou não entra ou não sai, porta malas muito pequeno, não é recomendado para familia"
"Contras";"este carro deixa muito a desejar em sua suspensão por ser muito dura, pois suas arrancadas exige muito de sua suspensão, por isso é muita folga e barulho."
"Contras";"O farol reflete os pingos de chuva acima dos para lamas do carro, em viagens longas voce tem que usar manga comprida, bate muito sol dentro do carro."
"Contras";"Suspensão traseira faz alguns estalos bem chatos em algumas manobras em baixa velocidade,o consumo é bem alto as borrachas das portas apresentam desgastes e rasgos, ao sair se não der uma boa acelerada o motor desliga dando um má impresão de mau condutor, reparei tbm que em velocidade de cruzeiro aproximadamente 85km/h em 5a marcha a rotação do motor é bem alta dando a impresão que o motor faz muito esforço para mater o carro andando."
"Contras";"Suspensão e barulho interno bate demais tudo imagino esses 206 com 20 anos de uso é uma escola de samba"
"Contras";"Porta Malas"
"Contras";"Ruídos internos, porém o carro tem 3 anos de uso."
"Contras";"A suspensão dianteira é muito elevada comparada á traseira, deixando o carro meio estranho de ladoManutenção cara se efetuada na autorizadaDifícil colocar rodas com aro maior que 16 por causa do cano do bocal de combustível, que é um pouco saliente e quase encosta no pneu traseiro direitoO apoio de braço das portas dianteiras parece feito de papelão, um dia me irritei com o trânsito e quebrei o do lado do motorista sem querer com o braço"
"Contras";"Caro pra caramba quando se fala em manutenção.Também tem um câmbio duro, porém confiável. Os amortecedores dele são muito sensíveis, assim como a parte de freios e escapamento. É um carro exclusivo do asfalto, não gosta de terra, nem foi feito pra ela."
"Contras";"Alguns ruídos internos, não muitos, manutenção cara, mas já encontro alternativas, a maçaneta do câmbio desintegrou, as novas são de couro, vem apenas uma chave do carro com alarme, sem segunda cópia."
"Contras";"Todos, carros bebe muito e não consegue descobrir o que é, fui apr praia grande e voltei o carro consumiu meio tanque, problemas na bobina, e a peugeot não tá nem ai, valor das peças um absurdo, caras demais,e só vendem nas concessionárias, deveriam ter lojas que pudessem vender mais baratas, até agora esse carro é ilusão total, repferia mil vezes meu golzinho 1.000 que tinha que andava mais do que esse...esse carro é um lixo"
"Contras";"na hora da reposicao de pecas:quando se encontra, levamos um susto c/ os precos das mesmas, quanto aos mecanicos, valorisam seus servicos,alem do normal. ferramental"
