"Classe";"Texto"
"Pros";"Este carro é muito bom quando se fala em motor, manutenção barata, isso quando dá algum problema, forte com uma exelente arrancada e desempenho, o meu deu 15,5km por Litro na estrada e 10,5km na cidade. Visual bacana, o meu é preto que é mais bonito, os bancos do G3 são bem confortaveis e com ajuste de altura. painel é lindo, com excelentes intrumentos."
"Pros";"são diversos possuo o meu há menos de um ano mais já turbinei ele e as 16v valvulas me forneceu alto desempenho, gostei muito dele mais quero vender pois tenho outro carro em casa, o meu tem kit superchager, ele dá km em questoes de poucos segundo.mesmo com aro 17 eu conseguia fazer seus incriveis 13 km/l e 10 km/l com o ar ligado,e também menos turbinado a alcool, faz de 5 a 7 km/l com rodas 17, caso queira que buchas terminais e molas trabalhem melhor coloque a do santana 2001 que fica perfeito e mais duravel"
"Pros";"Foi barato na época 2003 e eu coloquei direção hidráulica, vidros e travas elétricos e ar condicionado. O carro ficou um chuchu, continuou econômico e era muito melhor que o corsa 1.0 modelo kinder ovo pelado que eu tinha até então. Não deu nenhum defeito importante, a não ser o motor do vidro elétrico acessório depois que coloquei película e a caixa da chave chaveiro pesado. Também é alto, não bate no quebra-molas de jeito nenhum."
"Pros";"Motor VW , forte, mão de obra barata, até com chiclete arruma ele.Porta malas com um espaço muito bom,carro gostoso para dirigir na cidade ou mesmo viajar,bom bonito e barato!!!"
"Pros";"É um carro forte, já viajei com ele, rodei direto 2000 km sem problemas, coloquei GNV e mesmo assim subindo uma serra ele consegue passar um pálio, um fiesta,motor bom, sem dar problemas até agora!"
"Pros";"Custo-benefício excelente. Baixa manutenção e peças de reposição mais baratas. Ótimo desempenho - o motor 1.0 16v tem resposta de 1.6, excelente!"
"Pros";"Robustez, segurança, consumo compatível, mecânica impecável, belo estilo do G3 c/ presença no trânisto, pesadão mas gostoso de dirigir, freio animal."
"Pros";"desempenho muito bom mesmo em médias e altas rotações, consumo excepcional, direção, estabilidade, câmbio, acabamento.."
"Pros";"Motor forte, mesmo 8v, arrancada ótima, econômico, manutenção fácil e com custo baixo."
"Pros";"Baixa manutenção, estabilidade, direção hidráulica e ar condicionado muito, muito bons."
"Pros";"Custo de manutenção excelente. Para quem roda muito é o carro. Já tive Uno Fire Gas e este ganha somente no consumo e arranque (carro mais leve). Vem com regulagem de altura do banco. Ergonomia volante/câmbio/pedais excelente."
"Pros";"Motor Forte. Manutenção Simples. Carro de boa aceitação no Mercado. Carro ideal para o dia a dia"
"Pros";"Consumo, oferta de peças no mercado, mão-de-obra barata em manutenções...Mesmo sendo 16V, nunca tive problemas relacionados a vávulas, óleo, etc. Isto é um mito."
"Pros";"O carro é muito bonito, o G3 é mais bonito dos modelos feito até hoje, o interior tb agrada bastante, o motor é de alta tecnologia(1.0 turbo) e responde muito bem."
"Pros";"Estilo interior.Painel."
"Pros";"O design é muito bonito, baixo custo de manutenção salvo algumas peças do 16V, segue o padrão de qualidade dos carros da volks ou seja, não quebra fácil, tem um bom espaço interno e é muito gostoso de dirigir."
"Pros";"Visual mistura off road com city associado aos parachoques cinzas. Consumo excelente, na estrada ja fez 16,5 andando a 100 e faz mas se andar mais devagar...mas se passar dos 120 faz 12. Não quebra fácil, é gostoso de dirigir. painel bonito. Na cidade faz 11,5. É alto, na estrada de chão vai longe se souber dirigr, inclusive na lama. Não corre muito mas te leva onde você quer. tem bom torque. Cambios lembram carros esportivos, curtos e engatam facil. O meu é 8v dizem que o 16v não presta"
"Pros";"BOM CONSUMO, BOA DIRIGIBILIDADE"
"Pros";"Câmbio perfeito, ótima retomada em se considerando um carro 1.0, acabamento muito bom se compararmos com os concorrentes da categoria, resistente e confiável."
"Pros";"Infelizmente não lembro de algum."
"Pros";"pequena desvalorização, facilidade para encontrar peças, mecânica fácil, preço das peças, motor fraco mas confiável, bons faróis de fábrica, boa sinalização."
"Pros";"desempenho e resistencia das partes mecanicas, motor, cambio, suspensão, etc"
"Pros";"cONFORTO PARA DIRIGIR, BOA ESTABILIDADDE EMM CURVAS MUITOOOO BONITOOOO,SUPER MACIO,"
"Pros";"Motor, aparência."
"Pros";"Bastante estável na estrada."
"Pros";"A versão Trend é muito bonita ainda mais o vermelho. Carro de fácil comercialização. Freios confiavéis."
"Pros";"suspensa"
"Pros";"desempenho e beleza se comparado com outros carros da mesma categoria"
"Pros";"Câmbio, Motor."
"Pros";"Motor, durabilidade das peças e desempenho."
"Pros";"Possui baixo consumo, praticamente não dá manutenção, fácil de vender."
"Pros";"Peças com baixo custo, facilidade de manutenção, estabilidade."
"Pros";"Barato, bom valor de revenda."
"Pros";"boa aparencia"
"Pros";"Motor bem forte para 1.0, ótima estabilidade, suspensão bem justa e firme, é econômico...muito bom o carro."
"Pros";"Desing Bonito externo"
"Pros";"Economia gás 15/19alc 10/13Estabilidade, retomadas, carro bem forte."
"Pros";"consumo. nao da oficina o meu esta com 500000 km e so manutençao preventiva.nunca tive problemas. o meu carro faz media de 10km com alcool.andando a media de 110 km hr"
"Pros";"PELO VALOR E UM BOM CARRO."
"Pros";"estabil"
"Pros";"Valor de revenda, confiabilidade mecânica, desemprenho do motor 1.0 comparado com outros de mesma categoria."
"Pros";"carro bonito, valor de revenda bom, todo mundo conhece bem, peças faceis de achar."
"Pros";"e economico tanto no alcool como na gasolina"
"Pros";"é um carro muito comercial, fácil de ser vendido com pouca desvalorização! sua mecânica é extremamente simples e acessível!"
"Pros";"manutençao barata,e da para comprar as peças em algumas consecionarias c/desc."
"Pros";"Na versão TREND bancos com regulagem de altura, painel com contagiros, farois mascara negra, antena de teto, cintos de segurança dianteiros com regulagem na coluna."
"Pros";"Estilo,Desempenho para motor 1.0,manutenção barata,desvalorização."
"Pros";"custo beneficio e mecanica sao boas e barata e na hora da venda é bom pra negociar.Anda bem, consumo bom."
"Pros";"consumo desde o inicio sempre fez 10,5 na cidade e 12 no tirão,frente imponente e robusta."
"Pros";"Mecânica muito robusta, bom desempenho para 1.0, relativamente bonito, manutenção muito barata"
"Pros";"Anda bem para 1.0"
"Pros";"depois que o motor foi amaciado la pelos 15mil km o consumo caiu ligeiramente de 6, 7km/L para 12 km/L alcool na cidade e estrada andando a 100 chega a fazer 14 km/L."
"Pros";"boa estabilidade nas curvas, consumo medio"
"Pros";"manutenção fácil e barata, ótima estabilidade,"
"Pros";"Excelente visual, motor AP tem excelente arrancada e boa velocidade final para 1.0. Acabamento em plástico mais de boa qualidade."
"Pros";"manutenção, revenda, baixa depreciação"
"Pros";"tudo é barato"
"Pros";"nenhum"
"Pros";"Motor, desempenho na estrada, baixo consumo, boa resposta do freio, design."
"Pros";"Bom alinhamento da carroceria"
"Pros";"Ja tives outros gol bx 1984 1.6 outro 1986 1.6 S e 1989 1.6 GLestes eram otimas maquinas não davam e não tinham problemas era realmente confiaveis e duraveis"
"Pros";"Aparência, economico, bom de dirigir, nem pior nem melhor que um concorroente 1.0, apenas tem experiência20 anos"
"Pros";"o meu gol ao contrario do que muitos dizem é otimo ele faz 14.5 com gasolina e 11 a alcool o consumo depende muito do pé de quem dirigeo desempenho é otimo e nao deu nenhum defeito ainda"
"Pros";"Manutenção barata entre R$ 150 e R$ 250,00, ótima assistência da concessionária Blusa, seguro barato, consumo de 12,5 km/L na cidade e 17 km/L na estrada. Com certeza, recomendo. Creio que o Novo Gol não consegue bater em vários requisitos."
"Pros";"valor de revenda, aparencia externa, mecanica conhecida"
"Pros";"ESPAÇO INTERNO PEQUENO"
"Pros";"UM ÍTEM BACANA DESTE CARRO É O CÂMBIO, DISPARADO MELHOR CÂMBIO ÃO SE COMPARAR A PALIO CELTA ETC."
"Pros";"500 KM rodados e pude constatar a economia, bom de dirigir, vem com ar dr e outras 'cositas' e está atendendo 100 as minhas necessidades. Bom de dirigir, ótimo ar!!! - Preço: R 30.000,00completo!!!"
"Pros";"O DE QUALQUER CARRO COMUM"
"Pros";"Tenho um Gol GIV 2006 e outro 2008. O 2006 básico é ótimo, consumo dele é mto baixo, faz inacreditáveis 10,5 km no álcool na cidade já o 2008 completaço faz 6,5 km na cidade."
"Pros";"Os normais de qualquer carro..."
"Pros";"econom"
"Pros";"A valorização e aceitação no mercado, motor que da tranquilidade, baixa manutensão, são os pontos mais positivos, o visual do Kit Trend deu ao Gol o status merecido. A estabilidade fala a favor do G4. O carro mesmo Milzinho é pegador, mas nem tanto...Tive um 16V Milzinho por 3 anos, puxava bem mais, entretanto, outro na minha vida nunca mais, mesmo sendo muito cuidadoso e exigente com o carro so fiquei no preju. Já o G4 tem na aparencia e motorização seus pontos mais fortes.Se eu fosse comprar outro carro hoje seria o mesmo."
"Pros";"consumo, freio, preço de peças, durabilidade"
"Pros";"o carro anda bem, com consumo razoável! a tem estabilidade nas curvas e freia bem! o carro é estiloso sim! o meu é das versões mais completas! mt bom esse carro! quando comparado com outros da mesma categoria, eles perdem em estilo e motor! eu uso mt o meu carro! carrego mt peso nele só o gol pra aguentar o tranco!"
"Pros";"Mesmo turbinado, não tive nenhum problema com peças e outros generos que podessem dar preju."
"Pros";"prec"
"Pros";"TODOS ESTOU COM O CARRO HÁ 1 MES"
"Pros";"motor e muito forte...gostei muito desse 16...."
"Pros";"Motor forte por ser 1.0 e o carro tão pesado, espaçoso e bom de viagens....Excelente de revenda... Baixa manutenção..O AR gela bem!"
"Pros";"Ando com esse carro por estradas de terra que nem à própria Volkswagem imagina, sua suspensão nunca apresentou problema sérios, seu motor apesar de ser 1.0 fornece resposta rápidas e confiaveis, o cambio sempre preciso e os farois apresenta uma ampla visão noturna."
"Pros";"Motor robusto, boa estabilidade, consumo razoavel."
"Pros";"Não quebra, aguenta muito bem estrada e cidade, bem ao estilo da VW. Bom motor para um 1.0, quanto a aceleração e economia."
"Pros";"Preço: Paguei R$ 34.500 por um 1.6 completo (ar, direção, vidros e travas elétricos); Painel de instrumentos completo (conta-giros, marcadores de temperatura do motor, relógio digital e hodômetros total e parcial) e bonito (ficou bem melhor com o fundo branco e com o display preto/dígitos vermelhos); Ótimo desempenho do motor 1.6."
"Pros";"Apesar de 1.0 o motor é forte, freios eficientes, bom consumo, bons faróis, ventilação interna eficiente assim como o AC, direção hidráulica muito boa, acelerador macio, idem embreagem, instrumentos com boa visibilidade e eficientes."
"Pros";"O carro é bem bonito,quando funcionava tinha um bom desempenho e a suspensão elevada é funcional pros buracos de Sp."
"Pros";"Espaçoso,confortavel, motor confiavel."
"Pros";"Boa Dirigibilidade e robusto , painel interno bom e de facil leitura"
"Pros";"Estabilidade; valorização na revenda; cambio curto facilitando na passagem de machas; mesmo sendo um motor 1.0, sem dúvida é o melhor da categoria."
"Pros";"CONTINUA SENDO O MAIS FORTE, BONITO E PODER DE REVENDA ACIMA DA MÉDIA. MANUTENÇÃO EFICAZ."
"Pros";"motor ,cambio ,estabilidade,"
"Pros";"É um carro valente, dinâmico, acelera bem em todas as situações, é um bom carro de se ter na garagem, é o carro perfeito, digamos assim, o verdadeiro carro brasileiro (apesar da marca ser alemã) , feito para as estradas e ruas brasileiras mesmo, mesmo e mesmo. Além do mais, afirmando a minha confiança em relação à sua durabilidade (substituto do fusca)e óimo custo benefício representado por sua confialidade.Esse é o terceiro gol q tenho, e todos foram tirados zero Km, um 83 bx à àlcool, no qual fiquei 4 anos, nunca nem furou um pneu, o próximo foi em 1995, um gol plus mil, só ar qte, o primeiro à injeção, fiquei com ele 12 anos, e qdo vendi pelo preço de 12.500 reais e o cara ainda trocou 2 válvulas contente, achei graça,claro q desvalorizou um pouco, mas eu paguei nele exatos 10.500 reais na época. Agora peguei um Power 16 completo e olha, pode ter muito por aí, pode ser o q for, mas é o carro mais confiável que já conheci, vc é mais um na multidão, o valor de revendaéótim.recomendo"
"Pros";"Apesar de não precisar por enquanto o gol ainda tem o menor custo de mão de obra para meanutenção."
"Pros";"Motor, aceleração, retomadas, estilo agradavel, cambio bem escalonado, funciona muito bem com álcool, consumo."
"Pros";"Tem um bom arranque, retomada, é espaçoso, boa capacidade de porta-malas, o desempenho está parecido com um carro mais forte, porém consome menos. Veio com desembaçador e limpador do vidro traseiro, apesar de ser meio desengonçado para dirigir (principalmente na hora de manobrar e estacionar), é BEM leve. A visibilidade é boa para manobrar (se você não tiver problema em virar a cabeça ás vezes ao invés de olhar o espelho)."
"Pros";"motor sem duvidas é o forte do gol"
"Pros";"Desempenho, quebra qualquer outro 1.0 inclusive alguns 16V e 1.3 Fiat, cambio preciso e com relaçoes de marchas adequadas, estilo harmonioso e imponente como todo Gol deve ser"
"Pros";"Design moderno, acho que é um pouco maior que o G3 e tem um bom espaço interno."
"Pros";"Garantia de 1 ano livre de km. Gostei da frente dele tambem mais poderia ser melhor."
"Pros";"O motor 1.0 é muito valente, com o carro vazio você nao diz que esta dirigindo um carro 1000 cilindradas, responde bem, arranca bem. Sinceramente foi uma grata surpresa. Espaço interno é até brincadeira comparar com a concorrencia principalmente em relaçao a largura do carro, suspensao alta que se por um lado tira um pouco a estabilidade, por outro da uma praticidade tremenda. Iluminaçao excelente apesar dos farois simples. Consumo compativel com a melhora no motor (9 km/l cidade com alc) (12 km/l estrada com alcool rodando na faixa de 100/110 km/h)"
"Pros";"Estabilidade, motor muito elástico na estrada, desempenho geral muito bom, fica muito melhor após uns 10.000km, gosto da posição de dirigir, cambio veio um pouco duro mas ficou bem macio após o amaciamento. Por incrível que pareça não tem nenhum ruído interno. Fiz várias viagens com o carro dentre elas 2 de 2000 km com o carro totalmente carregado e fiquei muito satisfeito mesmo.O porta malas se souber usar cabe bastante coisa."
"Pros";"Tem boa visibilidade e um bom design"
"Pros";"TEM VÁRIOS, CONSUMO É ÓTIMO. 600kM COM UM TANQUE DE GASOLINA CIDADE/BR, JÁ QUE NO SUL O ÁLCOOL NÃO COMPENSA. ESTABILIDADE INCOMPARÁVEL, PEÇAS MUITO BARATA E PRATICAMENTE QUASE NÃO SE TROCA NADA. POTENCIA BOA, MELHOR 1.0. CAMBIO PERFEITO EM RELAÇÃO AOS DA FIAT QUE SÃO LONGOS. SE QUE VENDE É RÁPIDO. NEM PRECISA POR PLACA. ROBUSTO E BONITO DENTRO DOS SEUS LIMITES."
"Pros";"Muito bom e velocidade final, bons freios, otimo ar-condicionado, bom cambio etc."
"Pros";"OLHA EU JA POSSUI TRÊS CARROS, 01 CHEVETTE 85, O1 VOYAGE 86 E 01 PARATI 84, ESTE É MEU PRIMEIRO CARRO ZERO KM, EU ESTOU MUITO SATISFEITO, EU AMO CARRO DA VW, SOU UM APAIXONADO, POIS O PREÇO DE PEÇA E MUITO BARATO, EU ESTOU MUITO FELIZ."
"Pros";"O gol é o melhor 1.0. Fácil de revenda, peças baratas, ótimo para equipar, estabilidade muito boa, motor silencioso e além do mais é um carro bonito."
"Pros";"Motor com ótimo desempenho e muito forte nas arrancadas."
"Pros";"Ótimo carro, anda bem pra caramba! Dificil de dar problema, mas quando dá .... aiaiai, a brincadeira sempre acaba saindo caro. O consumo não é tão elevado, levando em consideração que o carro é 1.8. Ar condicionado é excelente, a direção é super macia."
"Pros";"Gol é gol, carro popular sem luxo mas durador, anda bem e é muito bom de curva."
"Pros";"lindão,um carro popular de facil e barata manutenção, resistente na estrada de chão e um baita motor apesar de ser 1.0.Da de 10a0 no g5,falo isso porque minha familia todos tem gol: g1,g2,g4 e g5, afinal é um carro pra pobre pois é muito resistente e pessas muiuuito barato."
"Pros";"Comprei o meu por um preço inferior ao Uno Mille com os mesmos itens méritos da Concessionária... Não podemos exigir de um carro deste o que o Focus oferece: é uma imensa injustiça, pois o Gol é um automóvel básico, simples. Dentro desta perspectiva, ele se mostra um veículo muito bom, confiável, robusto, econômico e, para minha surpresa, muito ágil no trânsito para um 1.0 o bom desempenho conferiu um certo deleite ao volante. A direção, que não é hidráulica, foi outra agradável surpresa, pois deveras muito leve."
"Pros";"POR SER UM MOTOR 1.6 ELE RESPONDE MUITO RAPIDO, ISSO É BOM DA CONFIANÇA EM QUE ESTA ATRAS DO VOLANTE,LOGICO TUDO COM MUITA SEGURANÇA,EU ACHEI TAMBEM O CARRO MUITO CONFORTAVEL."
"Pros";"Estética, a quase 30 vem sendo bem renovada."
"Pros";"É gol né, o meu é o Trend 1.0 8v completo, até agora não apresentou nenhum problema, é um carro q não tem conforto, mas dentro dos seus limites é um ótimo carro, peças baratas, qualquer mecânico arruma, econômico.."
"Pros";"consumo, bom preço, bos estabilidade para um 1.0, revenda, manutenção com preço razoavel, suporta bem tranco do dia a dia."
"Pros";"Excelente motor 1.0 total flex e com boas retomadas. Econômico, carro com boa estabilidade, bom espaço interno, boa posição de dirigir e melhora com a regulagem do cinto de seguranção e da altura do banco."
"Pros";"Quase nenhum!! Ainda é o torque do motor, mas mesmo assim, não fica mais tão a frente das outras montadoras. As peças e manutenção com preços baixos. Direção é leve."
"Pros";"Economico, não dá manutenção, quando precisar de manutenção é barata, pouca desvalorização no 1.0"
"Pros";"Durabilidade, digo isso, por ouvir falar, pois só tenho o meu a 2 anos"
"Pros";"durabil"
"Pros";"ECONOMICO TEM UMA BOA FLEXIBILIDADE APESAR DE TER A 4 MESES MAIS DEU PARA PERSEBER, QUE TEM UM BOM DESEPENHO NAS RETAS, SO NAS SUBIDAS E UM POUCO FRACO MAIS, E UM CARRO EXELENTE GOSTEI MUITO DELE EU RECOMEDO TA FAZENDO 12 COM ALCOOL E GASOLINA FAZ 14 E 15"
"Pros";"Bom por dentro fica a criterio, pois meu pai tem um prisma e é super apertado, agora o Gol G4 puts, muito espaçoso Demais mesmo, cabe 4 pessoas atras de 70 a 80kg na boa, e na frente acabamento ótimo, um moto AP muito bom de 1.0 Flex, nas retas o meu ja chego a 167km sossegado, embora marca 180km, mas ta bom, economico mesmo, pois é meu primeiro carro e ja tenho ótima visão dessa versão, macio com suspenção de molas altas, ótima estabilização nas curvas e um freio mediante que da para escapar de varias paradas, design e peças a preço muito interessante, da para tunar esse veiculo rapidinho com um ótimo preço e fica muito bonito na parte externa do carro, no mercado é um veiculo de bastante peças, no caso do Gol no brasil ja ficou popular e de facil acesso ao veiculo, na chuva tem um ótimo desembaçador trazeiro e dianteiro que ajuda muito, o ar dele é ótimo e tem umas saidas bem grandes com um tonalidade do ar bem alta, o painel digital e todo detalhado, um carro bem espaçoso"
"Pros";"Sempre tive veículo VW. Então sou suspeito para falar bem da marca. Com o atual Gol G4, 1.0 2008, é o 4º veículo da VW que possuo. Nunca tive problemas de fábrica com os veículos da marca que já possuí."
"Pros";"E um carro bom, tem um conforto ate legal, o meu e completo, não e um carro muito economico, dá 12km/l na cidade e só 13km/l na br andando em baixa rotação, mais no geral e um carro muito bom um carro que não te passa vergonha."
"Pros";"Cara, se vc estiver buscando um veículo econômico procure os da fiat, são muitos econômicos mas em relação a desempenho fica atras até de um fusca!!! pois oa carros fraquinhos da fiat, em uma ladeira um fusca sobe bem mais rápido. outra coisa pra mim o custo beneficil dos carrs daq fiat não compensa, devido a manutenção que os veiculos de hoje exigem, pois o meu gol 1.6 cara, foi a melhor coisa que eu fiz, foi trocar meu antigo veículo uma bomba xi.....andokkkk em gol g4. pois não passo mais vergonha de em uma ladeira pedir pros passageiros descer pra corro subir. kkk sério nunca mais!!!! Adeus carros da fiat. fiquem dando econômia e vergonha. Gente de boa, hoje o que importa é o desempenho e consumo tambem mais se vc for colocar no papel. a diferença não é grande. mas o desempenho sim."
"Pros";"estilo, motor forte e o impacto que da nas pessoas quando vc fala que tem um gol g4."
"Pros";"Muito econômico e o melhor motor dos carros 1.0"
"Pros";"O motor é forte para um 1.0 e o câmbio é preciso, conferindo boa agilidade. O carro, no geral, é robusto e aguenta bastante judiação. O ar condicionado muito potente, sem comprometer significativamente o desempenho, consumo razoável 10,2 km/l gasolina na cidade"
"Pros";"este é meu primeiro carro e até agora não tenho do que reclamar, pois o carro é excelente, tem uma ótima suspensão, boa altura em relação ao solo, um ótimo consumo na cidade e estrada cerca de 10 km/l com alcool na cidade e nunca viu uma oficina mecânica, so vou até a autorizada p fazer as revissões semestrais, enfim recomendo e pode acreditar no slogan USE SEM DÓ pois faço mensalmente uma viagem p o sul do pará em estradas de terra e o golzinho arrebanta e nunca quebrou, já vi diversos HONDAS DA VIDA no prego ou atolados....melhor compra que já fiz ...meu golzinho pe gueirreiro e bebe pouco hoje ele tá com 27.000 km sem ver a cara de um mecânico."
"Pros";"-Motor forte para carro 1.0, ágil nas retomadas, carro bonito, gosto muito da posição de dirigir, embora isso não seja a opinião da maioria. O porta-malas até que é espaçoso para um hatch."
"Pros";"nenhum"
"Pros";"O motor apesar de 1.0 é muito forte, anda muito bem. O freio tb é muito bom. Vende facil facil."
"Pros";"Carro lindo por dentro e por fora, espaço interno bom, melhor motor popular do Brasil."
"Pros";"bonit"
"Pros";"Motor excelente, encaixe das marchas precisos, Otimos freios e estabilidade. Manutençao facil e barata."
"Pros";"MANUTENÇÃO BARATA, QUALQUER UM CONSERTA MENOS A INJEÇÃO, EXCELENTE ESTABILIDADE, LUMINOSIDADE DO FAROL, DESENHO DO CARRO, O VIDRO TRASEIRO, QUE HOJE APARENTEMENTE É COLADO E POR CIMA DA LATA DA TAMPA DO PORTAMALAS, QUE NOS MODELOS ANTERIORES APODRECIA NA VOLDA DOS VIDROS, DESENHO DO PAINEL E FORRAÇÃO DAS PORTAS COM OS PORTA OBJETOS."
"Pros";"Todos, o carro é sensasional, por ser 1.0 ele anda bem, sou funcionario de empresa e faço muitas viajens, uso muito ele, e sempre que preciso do motorzinho ele me ajuda, numa ultrapassagem então, perfeito, chega a 140KM/H facil Facil"
"Pros";"Simplesmente sensacional o carro, seu motor 1.0 tem um desempenho acima de outros carros 1.0 e bom consumo na cidade e na estrada. Gostei da pega do volante e gostei de ser um carro um pouco mais durinho. Já tive Fiesta modelo novo completo, Uno, Clio 1.6, Audi A.3, Uno Turbo, Gol G2 Bola, Fiat Brava, Marea entre outros e afirmo que eu fiquei surpreendido com o folego do baixinho."
"Pros";"E UM CARRO SUPER RAPIDO DEIXA QUAQUER CARRO 1.8 NO CHINELO E SUPER ECONOMICO ENFRENTA TODAS ESTRADAS"
"Pros";"Bem, o carro é espaçoso, tem boa estabilidade, bom de freio e direção"
"Pros";"beleza, desempenho, estabilidade, custo"
"Pros";"estilo jóia"
"Pros";"lindo, porta-malas excelente"
"Pros";"Veiculo de boa aceitação no mercado"
"Pros";"nao tenho muito q reclamar do veiculo pq estou pouco tempo com ele, mas e e um carro muito bom anda bem e tem estabilidade pra andar."
"Pros";"fica na frente de qualquer 1.0 e de alguns 1.4 e é bom de dirigir"
"Pros";"Manutenção baixa e barata, carro bom para trabalho, freios eficientes em pista seca."
"Pros";"LINDO, CONFORTÁVEL, ESPAÇOSO, ECONÔMICO QUANDO SE SABE DIRIGIR, MANUTENÇÃO RARA E BARATA, COMERCIÁVEL"
"Pros";"TODOS POSSIVEIS, NÃO TEM OUTRO 1.0 QUE CHEGUE NEM PERTO"
"Pros";"Consumo, acabamento, espaço interno, com o kit trend ficou bem esportivo"
"Pros";"Estabilidade coerente, freios eficientes, manutenção relativamente barata, facilidade de encontrar peças, bom de revenda."
"Pros";"A aparência do carro é boa, anda bem, gasta relativamente pouco."
"Pros";"È GOL NÈ."
"Pros";"Economia, depois que criaram o bi-combustivel nao tem coisa mais economica, se vc tem pouco coloca alcool se tem bastante coloca gasolina, carro excelente para dirigir, com suspensao original de fábrica balança um pouco, mais anda bem alem de ser 1.0 8v ele é forte pra caramba, se vc pegar qualquer 1.0 por ai vai se bater bastante.todo mundo fala que ele consome muito mais na realidade ele só consome para que o motor possa ter mais força, se foce igual ao mile seria economico, mas nao teria força nem para rebocar carrinho de rolemã.acho que gosto é gosto e nao se discte, pois o carro é excelente."
"Pros";"deixa todos os outros mil pra tras. e não é tão gastão. o meu faz em media 9,5km/l e pisandinho ainda"
"Pros";"BAIXO CUSTO NAS MANUTENÇOES, FACILIDADE DE ENCONTRAR PEÇAS, BAIXA DESVALORIZAÇAO."
"Pros";"não desvaloriza, manutenção barata, bom de faróis, e pra qualquer terreno cidade e chão,inclusive para uso a trabalho, tenho o G4 plus completo que tem quase tudo, rodas faroletes,vidro ar trava direção, nem parece o gol de uns anos atráz"
"Pros";"ESTILO DO CARRO"
