"Classe";"Texto"
"Contras";"Apresentou defeito com menos de três meses de uso ar condicionado sem potência não é muito comercial."
"Contras";"Botões de controle do vidro no painel central."
"Contras";"ACABAMENTO DE PESSIMA QUALIDADE, PARECE QUE NAO TEM FORRAÇÃO ACUSTICA"
"Contras";"Ruídos - Todo o barulho do motor vai pra dentro da cabine, as molas dos bancos também fazem barulho irritante, o barulho do AC na velocidade 1 é baixo, na três vc precisa aumentar e muito o volume do som, depois de encher o tanque você escuta o combustível facinho lá dentro. Ou seja, isolamento acústico é PÉSSIMO."
"Contras";"O step externo muito fácil de ser roubado. Por segurança coloquei o CABOSEG. Esse tipo de segurança deveria ser oferecido pelo próprio fabricante."
"Contras";"Estepe do lado de fora ainda não foi usado."
"Contras";"Farol é extremamente fraco, se possível optem pelo farol de milha, acho que irá ajudar bastante. Freios ruins, tem que acostumar com a pisada. Aerodinâmica do veículo nem se fale, ao passar por um caminhão o carro balança inteiro, muito sensível aos ventos laterais em estrada. Isolamento acústico fraco, o ruído é alto, porém na média da categoria. Poderia incluir vidros elétricos traseiros e retrovisores elétricos na versão."
"Contras";"barulho de gasolina no tanque, estepe posição ruim, volante atrapalha a visão do painel,barulho peças plasticas"
"Contras";"Estepe embaixo do carro."
"Contras";"Poderia ser mais econômico, apesar de estar na média 7km com 1L de álcool na cidade. Apresenta alguns barulhos no interior mais nada que incomode muito. O valor da revenda não parece ser bom."
"Contras";"Ruidos internos que nao sao tao horriveis assim..."
"Contras";"O nível de ruídos internos poderia ser menor, mas não chega a ser absurdo como estão falando aqui no site. Não optei pelo som original com comando satélite na coluna de direção, o que é muito bom, pq só tem entrada auxiliar, não vem com USB."
"Contras";"Hmmmm....não tem opção de piloto automático, nem medidor de temperatura."
"Contras";"O ponto mais negativo é o barulho interno. Barulho da chuva no teto, ouve-se a transmissão, grilos aqui e ali. A Renault deveria despedir quem resolveu economizar desse jeito. O carro e o dono não merecem essa falta de respeito."
"Contras";"o barulho do motor invade o habitáculo já aos 3.000 rpm e alguns ruídos no painel quando o carro passa por vias irregulares ou paralelepípedos."
"Contras";"ENGATE DE CÂMBIO PODIA SER MAIS PRECISO E MACIO!, ESTABILIDADE SAI DE TRASEIRA EM CURVAS MAIS FORTES!, FARÓL MUITO FRACO!, ACABAMENTO PODIA SER MELHOR"
"Contras";"painel pobre para o valor do carro, parace de carro de R$15.000, mal colocados, simples demais, por 45.000 teriam qui ser bem mais acabados e o ar condicionado é fraco"
"Contras";"O carro é muito pesado para o motor 1.0 16v Autentic, Motor muito barrulhento, principalemente em subidas, Qualidade das palhetas originais é algo ridiculo, não funciona direito! Qualidade do tecido do estofamento é horrivel também, ja estou pensando em colocar capas para não detonar as mesmas.Como sou alto a visibilidade do painel não é boa! tenho que abaixar a cabeça as vezes para verificar os instrumentos!"
"Contras";"O motor 1.0, apesar dos 77cv, não correspondeu às expectativas, principalmente na estrada. O carro demora para desenvolver velocidade gerando bastante insegurança nas ultrapassagens. Tem retomada muito fraca, somente consegui um torque melhor na 3ª marcha. Até para subir ladeira em 1ª marcha, dependendo do grau de inclinação, há necessidade de subir o giro do motor, caso contrário o carro pode morrer. Meu carro anterior Gol, também 1.0, tinha melhor retomada e aceleração. O Sandero também faz muito barulho em alta velocidade e no paralelepípedo aparecem uns barulhos estranhos vou verificar na concessionária."
"Contras";"Realmente o ponto negativo deste hatch é exatamente o ruído do motor, um toque no acelerador e o bichinho grita. Porém, apenas isto me incomodou."
"Contras";"calor do motor entra no carro deixando insuportável, assento do banco do motorista rasgou com 30000km e a concessionária trocou, barulhos: no painel, tanque de gasolina, motor, péssimo acabamento interno muito fraco, ar condicionado fraco e barulhento, posição de acionamento dos vidros péssima, economia sem sentido, limpador de para brisa dianteiro trocado com 2000km"
"Contras";"Ruido do motor mais pela falta de forro no capò. falta de acabamento na parte das dobradicas do capô."
"Contras";"Acabamento, estepe posição incomoda"
"Contras";"Acabamento ruim, nivel de ruido excessivos, freios com desgaste prematuro, suspensão barulhenta desde os 1000 km , limpador de parabrisa com baixa velocidade, tecidos dos bancos muito simples sujam com facilidade, atendimento ruim na concessionária ,aceleraçao irregular com pouca kilometragem 5 mil km, voltante vibra ao passar em buracos, cambio balança."
"Contras";"Meu carro está com 19000km rodados. O barulho do motor dentro do carro é bem alto, um mecânico me mostrou o motivo: nos pés do motorista e passageiro da frente, o assoalho do carro é bem fino na altura do motor. Batam com a mão fechada e vocês confirmarão o que eu digo. O acionamento do vidro elétrico no centro no painel é horrível, até hoje não me acostumei. Não gosto do estepe a vista na parte de baixo do porta-malas, fico sempre apreensivo que ele será roubado cada vez que deixo o carro estacionado."
"Contras";"ja tive problemas com suspenção, com radio, painel, e outros ruidos que não deve aparecer em um carro 0 km"
"Contras";"Ruido Interno, Motor fraco para retomadas, Só anda bem depois dos 3mil giros do motor, motor muito barulhento."
"Contras";"Acho que é o normal de um carro 1.0, mas as vezes sinto falta de um motor mais potente.Acho que deveria ter comprado 1.6O botão do vidro no painel é meio estranho também."
"Contras";"Posição de acionamento dos vidros, Barulho de gasolina no tanque. Plásticos não são muito resistentesNão sei se é exclusividade dele, ou dos carros novos."
"Contras";"RUIDO INTERNO, PRINCIPALMENTE DA FORRAÇÃO DO TETO. SUSPENSÃO, AVALIADA PELA CONCESSIONARIA COM RUIDO SEM QUE SE TENHA UMA SOLUÇÃO CLARA. MARCADOR DE COMBUSTIVEL, TRÊS VEZES SUBSTITUIDO, INCLUINDO O TANQUE, MAS CONTINUA A NÃO MARCAR CORRETAMENTE."
"Contras";"A lataria é muito frágil no meu entender, mais frágil que os de outra marca, e o acabamento interno não é de primeira qualidade também deixa a desejar."
"Contras";"Problemas no marcador do combustível e tampa de abastecimento, já resolvido pela concessionária."
"Contras";"motor fraco antes tinha um fiesta que era pior, mais mesmo assim o motor do sandero deixa a desejar, acabamento interno um pouco simples"
"Contras";"BANCOS DESCONFORTAVEIS / 1ª MARCHA ESTRANHA / BARULHO DO MOTOR EM MARCHA LENTA / ACABAMENTO INTERNO MUITO FRACO / AR CONDICIONADO FRACO."
"Contras";"O limpador de parabrisa é muito barulhento. Um acabamento muito simples pelo preço e ser um top de linha. Garantia de 3 anos fajuta! Revisões e peças muito caras. Pós venda muito ruim."
"Contras";"bancos dianteiros tem uma folga de cinco centimetros, concessionaria diz que é caracteristica, mas o megane não tem que é uma outra categoria, lenta de 500 rmp ou seja liga o ar e ele apaga, tambem é caracteristica."
"Contras";"Acabamento interno depois de 3 anos se soltam e batem muito, fazendo barulhos altos. O sistema de freios é muito ruim, teve um gasto das pinças de freios anormal e isso faz com que tenha um barulho absurdo dentro do carro, a impressão é que a frente do carro vai desmontar. Precisei trocar as pastilhas de freios com menos de 10mil Km. O meu estepe ja foi roubado por duas vezes, pois o mesmo é em baixo do carro e muito fácil para cortar o suporte do estepe. Tenho que carregar o estepe dentro do porta malas, perdendo 40 por cento do mesmo."
"Contras";"REBATIMENTO DO BANCO TRASEIRO, PROJETO MUITO FRACO....DEVERIA SER EQUIVALENTE A DO HONDA FIT."
"Contras";"a ergonomia do carro é bastante ruim, e os bancos me parecem pouco confortáveis. A primeira marcha tem um comportamento esquisito, o estepe fica do lado de fora, o ar-condicionado é pouco eficiente, barulhento e não tem filtro de ar, passa calor do motor para a cabine, os vidros não tem opção um toque para descer."
"Contras";"MOTOR UM POUCO AMARRADO, MARCHAS MUITO REDUZIDAS."
"Contras";"Visibilidade na coluna traseira, acabamento sob os bancos, design do painel, ausência de temporizador do limpador de pára brisa traseiro"
"Contras";"Material do interior, Pouco Espaço entre os Bancos, Moderado torque na 1 marcha."
"Contras";"Bem, comprei em 2009 um Clio 0k, com 10.000km troquei por um Sandero Expression ano 2010 pois era meu sonho de consumo. Qual foi minha decepção. Comparando Clio/Sandeiro: ponto fraco da Sandero, farois ruins, barulho interno, paralamas não são de plástico, boca do tanque de combustivel não é de plastico, cambio do Clio dá de 10 a 0, o Clio tem marchas mais curtas, responde bem em qualquer terreno, so falta mesmo para completar uma 6°marcha, ai ficaria muito bom. Sandero de 2° marcha p/ 3° cai muito de giro, de 3°p/4° tambem, péssima relação de marchas."
"Contras";"Motor barulhento parece que está batendo valvulas, acionamento dos vidros, temperatura quente do motor passa para o interior do veículo. Acabamento péssimo, pobre, muito barulhento. Alto consumo de combustível e não responde muito bem."
"Contras";"Desvalorização é muito grande."
"Contras";"Motor 1.0 16v muito fraco para o carro e olha que eu não comprei com ar-condicionado, muito barulho interno com a rotação alta para compensar o motor, barulho de combustível batendo no tanque, estepe externo sempre sujo e de difícil acesso, alto consumo com etanol, falhas e economia de acabamento muito visíveis..."
"Contras";"Meio durão e comparando com outros veículos q já tive um pouco barulhento"
"Contras";"Ainda se ouve nitidamente o barulho do combustível no tanque, os vidros tinham de ser one-touch e iluminados, a 1ª, 2ª e 3ª eu acho que são muito curtas. O computador de bordo poderia marcar o consumo instantaneo"
"Contras";"O acabamento poderia ser melhor. Entre o capô e para brisas tem um vão que poderia ter um acabamento para tapar o buraco que ficouPosição do acionamento dos vidros elétricos dianteiros - poderiam ser no sistema one touchO Vibe poderia vir com retrovisores elétricos um carro desse porte, nem com vidros elétricos traseiros, que consegui ganhar da concessionária"
"Contras";"Posição de dirigir, falta um ajuste de altura do volante, como sou alto se fico com o banco alto escorrego do banco, se baixo o banco o volante fica numa posição ruim.O barulho do motor em baixa rotação incomoda um pouco parece que esta batendo valvula, mas é do tuxo hidraulico a embreagem tambem é ruidosa, mas é só aumentar um pouco o volume do som que esta tudo resolvido...."
"Contras";"É uma má-vontade, a potência é horrível, não deveria ser fabricado com motorização 1.0, porque ele é pesado. Nada de subir lombas com o ar-condicionado ligado! O acabamento interno deixa a desejar, o motor esquenta e o carro fica um forno, além do barulho..."
"Contras";"Consumo alto. Acabamento PÉSSIMO, lataria com soltas expostas e até parafuso com porca para fora ver portas da frente parte próxima ao fechamento. Internamento poderia ter melhor acustica, ruido muito perceptível e pode incomodar, principalmente na estrada ande no Honda Fit 1.3 para saber o que é acabamento interno e ZERO de ruídos"
"Contras";"Interior extremamanete pobre, rádio que parece ter sido comprado e instalado depois, cheio de barulhos, acabamento ruim."
"Contras";"Sistema de vidros, difícil pra quem esta na frente, pior pra quem vai atrás."
"Contras";"Acabamento pobre, bancos revestidos por tecidos ruins e plásticos das portas e do painel poderiam ser melhores."
"Contras";"Pra quem está acostumado com um som bom que aceita usb, este que vem de série deixa a desejar, pois se trocar o som, você perde aquele controlezinho que vem ao lado do volante! Ou seja, tem de ser o que vem de série, que aliás o meu já deu problema! O CD não toca!"
"Contras";"Posição dos acionadores dos 4 vidros elétricos, retrovisores externos pequenos, isolamento acustico do motor, falta de regulagem de altura e profundidade do volante."
"Contras";"o consumo está baixo devido à problemas recorrentes nos bicos injetores quando se usa alcool."
"Contras";"a fiat poderia caprichar mais no preço e no acabamento"
"Contras";"Por ser um carro popular o consumo é muito alto, e internamente muitos ruidos, suspensão dura mal acabado poderiam ter caprichado melhor."
"Contras";"Todos que se possa imaginar"
"Contras";"Extremamente básico."
"Contras";"Consumo um pouco alto, mas se tratando de um esportivo ta bom..."
"Contras";"cambio ruim"
"Contras";"Direçao hidraulica nao existe, espaço interno, passagem do passageiro para o banco de tras."
"Contras";"Seguro muito caro em relação ao valor do carro, engate da ré e da 5a. marcha, barulho interno das rodas no asfalto, facilidade de ter todas as portas com mossa, pouca arrancada e o pedal do acelerador que em viagens mais longas deixa o pé bastante cansado."
"Contras";"Suspensão dura, alguns ruídos."
"Contras";"Suspensão dura, conforto apesar de ser espaçoso os bancos são duros e o interior tem muito plástico."
"Contras";"porta malas pequeno"
"Contras";"fragilidade da chaparia e itens de acabamento"
"Contras";"Ruídos internos, principalmente na suspensão traseira, conforto para viagens longaso que não recomendo, acabamento interno e falta de instrumentos."
"Contras";"suspensão fraca faz muito barulho, tem que fazer geometria seguidamente."
"Contras";"porta malas pequeno, suspensao dura..."
"Contras";"É meio barulhento em trepidações. Nem a concessionária conseguiu resolver o barulho nos vidros. As portas são duras pra fechar, principalmente as traseiras tem que bater com força"
"Contras";"O classico Barulhinho da tampa do som traseira e outros pontos mais, trabalho com uma parati 1.6 2010 e ta com 11000km e faz mto mais barulho interno e externo que o meu uno."
"Contras";"Ruído interno é estressante. Ao comprar um uno, compre no mesmo dia um rádio com cd ou USB e instale, assim não ouvirá os ruídos e poderá fingir que eles não existem....A tampa do porta malas tem muitos grilos e não há regulagem, grafite em pó ou óleo que dê jeito. Acabamento interno é o basicão,tudo o que poderia ser de plástico na verdade é mesmo...Não é muito estável nas curvas, talvez rebaixando uma volta na frente melhore um pouco, pois o uno chega ser alto demais. Quanto ao painel, ainda bem que veio o velocímetro...A falta do indicador da temperatura é um ponto ruim, pois exige uma atenção maior sempre, para ouvir se a ventoinha está ligando com frequência e assim tentar adivinhar se o carro está quente demais. Pastilha e disco de freio novos estão fazendo o famoso barulho agudo típico de freio gasto. Me disseram que não há o que fazer. Tomara que seja assim..."
"Contras";"Falta de freio a disco na 4 rodas, carro leve então deve-se ter cuidado nas acelerações."
"Contras";"Suspensão é desconfortável em viagens longas e não tem muita estabilidade sobretudo no modelo WAY, interior muito espartano, barulho na suspensão traseira, péssima ventilação interna em dias de chuva."
"Contras";"tem que ficar de olho no alinhamento e na canbagem. Se começar a fazer barulho na suspensão traseira tem que trocar as buchas da balança.nas subidas não adianta força vc só vai estoura o seu motor,se antes da subida vc vier embalado ele sobi bem só ñ pode perde o giro e nen frear se ñ tem q ter paciencia."
"Contras";"Péssimo pára-brisa, limpador ineficiente. Ventilação interna sufoca o motorista, não ventila nada. Lataria casca de ovo, amassa muito fácil. Painel muito simples, carpete interno ruim. Seguro muito caro. Freio de mão barulhento. Pintura sólida risca fácil. Suspensão dura. Correr a pé na rua de terra, balança demais."
"Contras";"ACABAMENTO INTERNO PESSIMO, INSTRUMENTOS SÃO BASICOS DO BASICO MESMO ACHO QUE SO COLOCARAM MARCADOR DE VELOCIDADE E GASOLINA PQ NAO PODIA FALTAR MESMO KKK, SENAO ELES CORTAVAM TAMBEM."
"Contras";"a suspensão traseira é um lixo, os engenheiros estavam bebados quando desenharam o sistema de suspensão, pois os pneus começam a comer por dentro, e nao é falta de cuidado nao pois meu carro ja foi feito suspensão completa e cambagem."
"Contras";"Manutenção muito cara quando realizada em concessionária, designe antigo, acabamento interno muito simples e carro com pouquíssima estabilidade."
"Contras";"Motor barulhento quando usado o álcool. Consumo bem inferior ao prometido pelo vendedor e pelo manual. Faço 17 km/l na estrada foi prometido 22 e na cidade faço 12 km/lfoi prometido 16. Com alcool, faz 8 km na cidade e não chega a 12 km na estrada andando a menos de 100 km/h. Seguro muito caro, em torno de R$ 1.500.Revisões muito cara. Bancos dianteiros, a espuma esfarela-se com muita facilidade e a capa do banco solta-se facilmente."
"Contras";"RUIDOS, REQUER UM MAIOR CUIDADO NO ALINHAMENTO E BALANCEAMENTO DAS RODAS DIANTEIRAS.ESTOFAMENTO DO ASSOALHO MUITO SIMPLES"
"Contras";"Não é confortável, porta malas pequeno."
"Contras";"Muito Ruido, Tampa traseira, interna, muito barulhenta por ser plastica, Muito material plastico, não ter relógio para temperatura, não vir de fábrica com isqueiro"
"Contras";"acab"
"Contras";"O banco do motorista poderia recuar um pouquinho mais para poder esticar mais um pouco as pernas e a dirigibilidade ficar perfeita."
"Contras";"confort"
"Contras";"Pouco confortável e o motor não resistiu o tempo que esperava dele."
"Contras";"sempre fazer alinhamento por que gastas os pneus, muito leve na pista, suspensao muito fraca"
"Contras";"Caída média do desempenho na retomada da estrada, porta-malas pequeno, estepe na frente fácil para ladrão roubarja tive um roubado,só o estepe,um carro que é fácil de capotarem curvas e alta velocidade-a traseira rebola fácil."
"Contras";"Acabamento muito ruim. Cintos não são retráteis nos bancos traseiros. Ruidos aparecem muito fácil com o tempo, princ ao lado do motorista, com um ruido no anel do cinto de segurança. Carro muito fraco para transporte de 5 passageiros. Dispositivo para regular distância dos bancos da frente é obsoleto. Design muito antigo, sem mudanças consideráveis ao longo dos quase 20 anos do Uno."
"Contras";"Algus ruidos nas imperfeições do solo. Sofre um pouco em subidas muito ingrimes com lotação maxima do carro, porém comum de um carro 1.0"
"Contras";"Varios ruídos internos, farol ilumina pouco, posição do radio muito baixa, carro com desenho velho e alto consumo de agua."
"Contras";"cambio não muito macio"
"Contras";"suspenção de ves em quando faz uns barulhos tipo ruidos, e um pouco duro"
"Contras";"Suspensão dura, estilo ultrapassado, não tem muita estabilidade, seguro alto, e lataria extremamente fraca amassando muito facilmente."
"Contras";"O carro apresenta alguns ruidos que nao ah mecanico na façe da terra que encontre. o meu as vezes parece que porta trazeira direita esta mau fechada, o carro podia ter mais porta objetos , porta copos , suspensao super dura , fora isso um OTIMO CARRO"
"Contras";"POSICAO DE DIRIGIR PARA QUE TEM MAIS DE 1,80 É COMPLICADO. PREÇO DO SEGURO."
"Contras";"SUSPENSÃO UM POUCO DURA, RUIDO EMBAIXO DO CARRO E NO TETO ESTE IMPOSSIVELDE DESCOBRIR"
"Contras";"Qualidade dos materias de revestimento interno , mas justifica pelo preço que era vendido na época e se levar em conta que é um carro popular. Ruídos internos , mas que podem ser resolvidos com feltro."
"Contras";"Ruídos, lataria frágil, sem conforto interno"
"Contras";"unica coisa que poderia ser como a do celta é o motor mas o do uno atende bem mas o motor do 1.0 é um canhãizinho."
"Contras";"Preço muito alto"
"Contras";"Sua lataria é frágil demais, a ponto de não poder nem mesmo encostar, para não causar morças. Muito fraco se possuir kit gás e ainda quiser ligar o ar. Quase para de andar!!!"
"Contras";"Suspensão dura, portas do 0KM difíceis de fechar sem bater com força, ruídos internos, acabamentos internos."
"Contras";"ruido no motor, e grilo no teto e barulho nas portas versao 4 portas"
"Contras";"sempre tem q andar dando uma limpeza no carburador, é de praxe, apresenta ruidos no eixo, suspensão nao mt boa."
"Contras";"Câmbio não é muito bom para engatar as marchas, tem q aprender a fazer com o tempo com precisão. Motor é fraco para viagens e retomadas, mas também é um 48 cv né? que q eu ia querer ? Um marcador de temperatura de motor seria muito importante para a gente acompanhar, aliás em todos os carros deveria ter isso."
"Contras";"lataria muito vulnerável ,deixa os passageiros com sensação de insegurança pois é muito fraca por exemplo se esquecer de sotar o capô e empurra-lo desagradavelmente ele vai simplesmente amassar a lata tem a resistencia de uma folha de papel."
"Contras";"durabil"
"Contras";"Péssimo acabamento e espaço interno. Pouco conforto, por causa dos bancos de baixa qualidade. Muito pouco equipado para a versão de entrada. Excesso de ruído interno, graças ao painel mal acabado e de baixa qualidade e a pouca vedação acústica. Materias, como plásticos e borrachas de vedação, parecem se desgastar com facilidade. Dificuldade para o engate das marchas, principalmente a 3ª."
"Contras";"Suspensão dura, acabamento interno pobre, com o ar-condicionado ligado o carro perde muita potência se comparando com outros da categoria."
"Contras";"Suspensão extremamente frágil e barulhenta, bate até no asfalto nada de conforto acabamento de última categoriasó plástico pouco econômico8km/l na cidade motor extremamente fraco parte elétrica caótica ruído interno insuportável, bate tudo câmbio de trator extremamente duro e de engates difíceis etc etc etc"
"Contras";"SUSPENÇAO DURA!"
"Contras";"Infelizmente era minha altura que tenho 1,86 por causa de perna direita longa encostando ao lado de som. Devido à câimbra durante a viagem. E a maior decepção é a ferrugem."
"Contras";"Pouco conforto é um carro duro com pouca estabilidade, mas mesmo assim na minha opinião continua sendo o melhor carro para trabalho meu caso"
"Contras";"Consumo e espaço"
"Contras";"alguns ruidos na tampa traseira, mas também com as nossas estradas."
"Contras";"A suspensão é barulhenta, após um dia de chuva o carro fica fazendo vários rangidos, a estabilidade é o maior ponto fraco."
"Contras";"Apresenta alguns ruídos na suspensão inheco inheco e sente muito os buracos e irregularidades da pista. O banco do motorista poderia ser mais ergonômico. O acabamento interno poderia ser melhor, neste ponto perde para outros como Celta e Gol devido à simplicidade, mas isto é o que justamente torna o Uno um carro barato. Boa parte dos revestimentos de chão e próximo ao câmbio são de carpete, por isto suja muito e é difícil de limpar. O Marcador de combústivel não é muito preciso quando chega a menos de meio tanque. A luz de reserva também não é de confiança. A fiação elétrica das portas é um outro problema apresentado pelos mecânicos pois é costume os fios se romperem. O porta-malas é pequeno."
"Contras";"Não possui presença alguma"
"Contras";"eh um carro bem basico, falta um pouco mais de estilo, eh meio apertado."
"Contras";"barulho dos amostecedores trazeiros"
"Contras";"barulhento lataria muido fraca acabamento horrivel flata de instrumentos no painel tipo marcador de temperatura"
"Contras";"O básico, surge fácil pontos de ferrugem a suspensão traseira é um saco até hj.suspensão dura tem vez que parece que um buraco simples é uma cratera. O material das peças acho meio sem qualidade vc conserta uma coisa e parece que surge rangido em outro lugar uns grilos dificeis de achar."
"Contras";"Seus pontos negativos são, em relaçao, ao câmbio, que apesar de ter 5 marchas, é meio duro e também aos seus instrumentos, que no caso da versão do meu Mille, são poucos."
"Contras";"caixa de cambio, suspensao traseira"
"Contras";"Só faz um pouco de barulho mas a maioria das vezes é o escapamento que solta da borracha e o câmbio arranha um pouco na terceira e a ré entra bem dura mas isso eu resolvi no meu trocando os reparos do câmbio e utilizando o óleo de câmbio 80w e claro nao deichando o óleo faltar."
"Contras";"Detesta combustivel ruim, logo reclama, as borrachas da porta desgastam com facilidade, custo do seguro elevado."
"Contras";"Muito desconfortável, suspensão muito dura você fica pulando conforme os buracos da estrada. Acabamento muito simples. Consumo poderia ser melhor, carro sem ar condicionado e sem Direção faz 15 a 16 km/l gasolina e 10 a 11 no alcool."
"Contras";"o velho rangido da parte traseira que ninguém sabe de onde vem, isso é um classico defeito dos fiats brava, marea, tempra, tipo e quase todos"
"Contras";"O designe, poderia ser mais próximo do cinquececento. Facilidade de arrombamento das portas. Painés laterais no banco traseiro, plástico, batem com facilidade, no carros deduas portas. O CONFIAT poderia ser por dois anos, já que o carro não da problema."
"Contras";"O enferrugamento do numero do chassi e o cuidado com a correia dentada, mas só isso."
"Contras";"A Fiat deixa a desejar..."
